{
  "schema_version": "0.11.0",
  "pair_id": "pair-commission-judgment",
  "pair_type": "judgment",
  "input": {"feature_id": "commission-plans", "lifetime_records": 0},
  "output": {"verdict": "DROP", "usage": "never"},
  "rationale": "A complete-history runtime census supports the synthetic conclusion.",
  "label_authority": "analyst",
  "dataset_role": "development",
  "split_group": "commission-plans-analysis",
  "evidence": [
    {
      "evidence_id": "ev-commission-census",
      "evidence_class": "runtime",
      "plane": "transactional",
      "claim": "No commission plan or execution record exists in the complete synthetic history.",
      "source": "synthetic lifetime census query v1",
      "observed_at": "2026-07-28T10:00:00Z",
      "coverage": {"kind": "all-time", "start": "2019-03-02", "end": "2026-07-28"},
      "confidence": "high",
      "sensitivity": "public",
      "supports": ["usage", "verdict"]
    }
  ],
  "provenance": {
    "app": "fixture-app",
    "teardown_id": "fixture-teardown",
    "phase": 3,
    "created_at": "2026-07-28T10:05:00Z",
    "source_artifact_refs": ["tests/fixtures/valid-unused-with-nulls.json"]
  },
  "sanitization_tier": "sanitized-shareable",
  "sanitization_review": {
    "status": "approved",
    "reviewed_by": "fixture-reviewer",
    "reviewed_at": "2026-07-28T10:10:00Z",
    "method": "synthetic fixture inspection"
  }
}
